<?xml version="1.0" encoding="UTF-8" standalone="yes"?>
<SimkitAssembly name="TestServerGenericAssembly" version="2.0" author='ahbuss' description="Provide a unit test for ServerGeneric event graph" package="examples" xsi:noNamespaceSchemaLocation="../../../../Schemas/assembly.xsd" xmlns:xsi="http://www.w3.org/2001/XMLSchema-instance">
    <SimEntity name="ServerGeneric" type="examples.ServerGeneric" description="">
        <TerminalParameter name="totalNumberServers" value="1" type="int"/>
        <FactoryParameter factory="simkit.random.RandomVariateFactory" type="simkit.random.RandomVariate">
            <TerminalParameter name="" value="Constant" type="java.lang.String"/>
            <TerminalParameter name="" value="1.1" type="double"/>
        </FactoryParameter>
        <Coordinate x="390.0" y="200.0"/>
    </SimEntity>
    <SimEntity name="ArrivalProcess" type="examples.ArrivalProcess" description="Provide arriving customers">
        <FactoryParameter factory="simkit.random.RandomVariateFactory" type="simkit.random.RandomVariate">
            <TerminalParameter name="" value="Exponential" type="java.lang.String"/>
            <TerminalParameter name="" value="1.2" type="double"/>
        </FactoryParameter>
        <Coordinate x="140.0" y="200.0"/>
    </SimEntity>
    <SimEntity name="EntityCreator" type="examples.EntityCreator" description="create entities">
        <Coordinate x="260.0" y="200.0"/>
    </SimEntity>
    <SimEventListenerConnection listener="EntityCreator" source="ArrivalProcess"/>
    <Adapter name="arrivalAdapter" eventHeard="EntityArrival" eventSent="Arrival" from="EntityCreator" to="ServerGeneric" description=""/>
    <Schedule stopTime="100." verbose="false" saveReplicationData="true"/>
    <Experiment replicationsPerDesignPoint="30" totalSamples="1" timeout="5000"/>
</SimkitAssembly>
