<?xml version="1.0" encoding="UTF-8" standalone="yes"?>
<SimkitAssembly name="InventoryModelAssembly" version="1.0" package="examples" xsi:noNamespaceSchemaLocation="http://diana.nps.edu/Simkit/assembly.xsd" xmlns:xsi="http://www.w3.org/2001/XMLSchema-instance">
    <SimEntity name="arrivalProcess_0" type="examples.ArrivalProcess" description="">
        <FactoryParameter factory="simkit.random.RandomVariateFactory" type="simkit.random.RandomVariate">
            <TerminalParameter name="" value="Uniform" type="String"/>
            <TerminalParameter name="" value="0.9, 2.2" type="Object..."/>
        </FactoryParameter>
        <Coordinate x="100.0" y="200.0"/>
    </SimEntity>
    <SimEntity name="inventoryModel_1" type="examples.InventoryModel" description="">
        <FactoryParameter factory="simkit.random.RandomVariateFactory" type="simkit.random.RandomVariate">
            <TerminalParameter name="" value="DiscreteInteger" type="String"/>
            <TerminalParameter name="" value="new int[] {1, 2, 3, 4}, new double[] {40, 30, 20, 10}" type="Object..."/>
        </FactoryParameter>
        <FactoryParameter factory="simkit.random.RandomVariateFactory" type="simkit.random.RandomVariate">
            <TerminalParameter name="" value="Gamma" type="String"/>
            <TerminalParameter name="" value="1.7, 1.8" type="Object..."/>
        </FactoryParameter>
        <FactoryParameter factory="simkit.random.RandomVariateFactory" type="simkit.random.RandomVariate">
            <TerminalParameter name="" value="Constant" type="String"/>
            <TerminalParameter name="" value="1.8" type="java.lang.Object"/>
        </FactoryParameter>
        <TerminalParameter name="I0" value="15" type="int"/>
        <TerminalParameter name="bigS" value="10" type="int"/>
        <TerminalParameter name="littleS" value="5" type="int"/>
        <Coordinate x="410.0" y="200.0"/>
    </SimEntity>
    <SimEventListenerConnection listener="inventoryModel_1" source="arrivalProcess_0"/>
    <Schedule stopTime="100000.0" verbose="true"/>
</SimkitAssembly>
