<?xml version="1.0" encoding="UTF-8" standalone="yes"?>
<SimkitAssembly name="ServerWithRenegesAssembly" version="1.0" package="examples" description="TODO add description" xsi:noNamespaceSchemaLocation="http://diana.nps.edu/Simkit/assembly.xsd" xmlns:xsi="http://www.w3.org/2001/XMLSchema-instance">
    <SimEntity name="arrivalProcess" type="examples.ArrivalProcess">
        <FactoryParameter factory="simkit.random.RandomVariateFactory" type="simkit.random.RandomVariate">
            <TerminalParameter name="" value="Exponential" type="java.lang.String"/>
            <TerminalParameter name="" value="1.5" type="double"/>
        </FactoryParameter>
        <Coordinate x="40.0" y="140.0"/>
    </SimEntity>
    <SimEntity name="creator" type="examples.Creator">
        <Coordinate x="190.0" y="140.0"/>
    </SimEntity>
    <SimEntity name="serverWithReneges" type="examples.ServerWithReneges">
        <TerminalParameter name="numberServers" value="2" type="int"/>
        <FactoryParameter factory="simkit.random.RandomVariateFactory" type="simkit.random.RandomVariate">
            <TerminalParameter name="" value="Gamma" type="java.lang.String"/>
            <TerminalParameter name="" value="2.5" type="double"/>
            <TerminalParameter name="" value="1.2" type="double"/>
        </FactoryParameter>
        <FactoryParameter factory="simkit.random.RandomVariateFactory" type="simkit.random.RandomVariate">
            <TerminalParameter name="" value="Uniform" type="java.lang.String"/>
            <TerminalParameter name="" value="4" type="int"/>
            <TerminalParameter name="" value="6" type="int"/>
        </FactoryParameter>
        <Coordinate x="350.0" y="140.0"/>
    </SimEntity>
    <PropertyChangeListener name="numberInQueueStat" type="simkit.stat.CollectionSizeTimeVaryingStats" mode="replicationStat" meanStatistics="false" countStatistics="true">
        <TerminalParameter name="p[0] : " value="queue" type="java.lang.String"/>
        <Coordinate x="560.0" y="60.0"/>
    </PropertyChangeListener>
    <PropertyChangeListener name="numberAvailableServersStat" type="simkit.stat.SimpleStatsTally" mode="replicationStat" meanStatistics="false" countStatistics="true">
        <TerminalParameter name="p[0] : " value="numberAvailableServers" type="java.lang.String"/>
        <Coordinate x="350.0" y="290.0"/>
    </PropertyChangeListener>
    <PropertyChangeListener name="numberServedStat" type="simkit.stat.SimpleStatsTimeVarying" mode="replicationStat" meanStatistics="false" countStatistics="true">
        <TerminalParameter name="p[0] : " value="numberServed" type="java.lang.String"/>
        <Coordinate x="350.0" y="20.0"/>
    </PropertyChangeListener>
    <PropertyChangeListener name="numberRenegesStat" type="simkit.stat.SimpleStatsTimeVarying" mode="replicationStat" meanStatistics="false" countStatistics="true">
        <TerminalParameter name="p[0] : " value="numberReneges" type="java.lang.String"/>
        <Coordinate x="560.0" y="140.0"/>
    </PropertyChangeListener>
    <PropertyChangeListener name="numberArrivalsStat" type="simkit.stat.SimpleStatsTimeVarying" mode="replicationStat" meanStatistics="false" countStatistics="true">
        <TerminalParameter name="p[0] : " value="numberArrivals" type="java.lang.String"/>
        <Coordinate x="40.0" y="260.0"/>
    </PropertyChangeListener>
    <SimEventListenerConnection listener="creator" source="arrivalProcess"/>
    <PropertyChangeListenerConnection property="queue" listener="numberInQueueStat" source="serverWithReneges"/>
    <PropertyChangeListenerConnection property="numberAvailableServers" listener="numberAvailableServersStat" source="serverWithReneges"/>
    <PropertyChangeListenerConnection property="numberServed" listener="numberServedStat" source="serverWithReneges"/>
    <PropertyChangeListenerConnection property="numberReneges" listener="numberRenegesStat" source="serverWithReneges"/>
    <PropertyChangeListenerConnection property="numberArrivals" listener="numberArrivalsStat" source="arrivalProcess"/>
    <Adapter name="adptr_3" eventHeard="CustomerArrival" eventSent="Arrival" from="creator" to="serverWithReneges"/>
    <Output entity="creator"/>
    <Output entity="arrivalProcess"/>
    <Output entity="serverWithReneges"/>
    <Schedule stopTime="100.0" verbose="false"/>
    <Experiment replicationsPerDesignPoint="1" totalSamples="1" timeout="5000"/>
</SimkitAssembly>
